headline_id,symbol,published_at,source,headline,article_url,scraped_at
30c2d5aba273ecaf,Adani Power,1 week ago,Financial Express,"Adani seals Rs 5,693-cr Jaypee buyout; Adani Power acquires 24% in JPVL. Adani Ports also completes acquisition of JFIL in the Jaypee deal.",https://t.co/2u2Xg1Vi7i,2026-05-30T10:34:58.289205+00:00
39fc2e617b616161,JSW Steel,1 day ago,ScoutQuest,"JSW Steel sees a descending triangle breakout with close above resistance. Rising volumes, higher highs, and bullish candlesticks signal strong momentum.",https://sqst.in/shareMessage?msgId=848042597515682553,2026-05-30T10:34:59.942877+00:00
68c415b7b4a497ba,JSW Steel,3 days ago,Marketsmojo,"JSW Steel touched an all-time high of Rs 1,326.2 on May 27, 2026. The stock reflects strong performance across financial and technical metrics in ferrous metals.",https://www.marketsmojo.com/news/stocks-in-action/jsw-steel-ltd-stock-hits-all-time-high-amid-strong-market-performance-4016665,2026-05-30T10:34:59.942891+00:00
8783146d5f4379d1,JSW Steel,4 days ago,ET NOW,"JSW Energy announces ₹4,000 cr QIP and ₹3,150 cr stake monetisation in JSW Steel. Sharad Mahendra highlights dual benefits and objectives of these financial moves.",https://x.com/ETNOWlive/status/2059225154925019143,2026-05-30T10:34:59.942896+00:00
5c7227f79813deeb,JSW Steel,5 days ago,Business Standard,"JSW Steel to start work on ₹1 trillion steel plant on ex-POSCO land. The plant will be located near Paradip, Odisha, after POSCO's failed venture.",https://www.business-standard.com/companies/news/jsw-to-commence-work-on-1-trillion-steel-plant-on-ex-posco-land-126052501544_1.html,2026-05-30T10:34:59.942905+00:00
4eea7ebf26c3a5b0,JSW Steel,1 week ago,NDTV Profit,"Experts suggest holding Apollo Tyres, Siemens; buying JSW Steel, Hero MotoCorp, NMDC. Vodafone Idea calls for cautious profit booking. Challenges include crude price impact on Apollo Tyres, debt issues for Vodafone Idea. JSW Steel, NMDC show upside potential; Siemens sees strength.",https://www.ndtvprofit.com/markets/buy-sell-or-hold-apollo-tyres-jsw-steel-vodafone-idea-hero-motocorp-siemens-ask-profit-11524869#publisher=newsstand,2026-05-30T10:34:59.942911+00:00
5abdc34519469df0,JSW Steel,1 week ago,BSE,"JSW Energy sold 25,000,000 JSW Steel shares (1.02% equity) via bulk deal on May 18, 2026. Post-sale, JSW Energy's stake in JSW Steel decreased to 44.29% from 45.32%.",https://www.bseindia.com/stockinfo/AnnPdfOpen.aspx?Pname=3C606815_9755_4934_B00F_08C9A846C30C_101104.pdf,2026-05-30T10:34:59.942915+00:00
36786cd612573692,JSW Steel,1 week ago,Marketsmojo,"JSW Steel's P/E at 41.9 exceeds industry's 26.4; strong institutional interest supports its Nifty 50 role. Despite Mojo Grade downgrade to Hold, JSW Steel retains sector leadership in India's ferrous metals.",https://www.marketsmojo.com/news/stocks-in-action/jsw-steel-ltd-navigating-nifty-50-membership-and-institutional-shifts-amid-sector-dynamics-4002392,2026-05-30T10:34:59.942920+00:00
f51454649e8e9b85,JSW Steel,2 weeks ago,The Economic Times,"JSW Energy's Rs 3,150-crore JSW Steel stake sale aims to reduce debt. Jefferies discusses implications of the stake sale for JSW Energy's finances.",https://economictimes.indiatimes.com/markets/stocks/news/how-jsw-energies-rs-3150-crore-jsw-steel-stake-sale-will-help-lower-debt-jefferies-explains/articleshow/131191552.cms,2026-05-30T10:34:59.942924+00:00
45e58d600c0617de,JSW Steel,2 weeks ago,NSE Block Trades,JSW Energy Ltd sold 25M shares of JSW Steel Ltd at ₹1260 avg price.,https://www.nseindia.com/report-detail/display-bulk-and-block-deals,2026-05-30T10:34:59.942928+00:00
0eba776bb6fa8c58,Bharti Airtel,1 day ago,ScoutQuest,"Bharti Airtel saw a block deal of 1.37 crore shares, 0.18% equity. Shares traded at Rs 1,832 each, totaling Rs 2,517 crore.",https://sqst.in/shareMessage?msgId=848046136216413061,2026-05-30T10:35:01.714522+00:00
9b12fa958d58e45c,Bharti Airtel,2 days ago,The Hindu BusinessLine,"Bharti Airtel and Reliance Jio support premium 5G services for high-paying users. Vodafone Idea opposes, warning against a two-tier internet ecosystem.",https://www.thehindubusinessline.com/news/priority-5g-service-sparks-new-telecom-war/article71034246.ece,2026-05-30T10:35:01.714548+00:00
f18a541b1d2e188c,Bharti Airtel,3 days ago,The Economic Times,"India's prepaid and postpaid ARPUs are converging after 5 years, say analysts. Operators' tariff repair efforts have driven this ARPU convergence phase.",https://telecom.economictimes.indiatimes.com/news/industry/indias-telecom-arpu-convergence-a-look-into-prepaid-and-postpaid-trends/131347175?utm_source=portal_category_widget&utm_medium=homepage,2026-05-30T10:35:01.714560+00:00
ca0ef0527e45b7d0,Bharti Airtel,3 days ago,ET NOW,"Key stocks in focus today include ONGC, Coal India, Bharti Airtel, and IRCTC. KEC International is also among the stocks to watch on May 27.",https://www.etnownews.com/markets/stocks-to-watch-today-may-27-ongc-coal-india-kec-international-bharti-airtel-irctc-and-others-article-154405398,2026-05-30T10:35:01.714565+00:00
e0acf2a35da52db2,Bharti Airtel,4 days ago,Financial Express,TRAI report shows Jio nearing Airtel's pace of net additions in Apr'26. Jio's growth in net additions reflects increasing competition with Airtel.,https://t.co/xUCjqOjncT,2026-05-30T10:35:01.714569+00:00
c8d5066957fc0656,Bharti Airtel,4 days ago,CNBC TV18,"India added 6.18M mobile subscribers in April, down from 8.43M in March; Airtel gained 3.14M users, Jio 2.94M. TRAI released a consultation paper on V2X communication, favoring 4G/5G networks for connected mobility; comments invited by May 2026.",https://www.cnbctv18.com/technology/telecom/telecom-subscriber-additions-slow-in-april-airtel-jio-lead-user-gains-trai-ws-l-19913897.htm,2026-05-30T10:35:01.714575+00:00
8d04b86d0474d128,Bharti Airtel,4 days ago,ET NOW,"India's telecom subscriber growth slowed in April as major operators saw declines. Key players affected include Bharti Airtel, Jio, BSNL, and Vodafone Idea per TRAI data.",https://x.com/ETNOWlive/status/2059275467614822598,2026-05-30T10:35:01.714579+00:00
4c8b1c9eea6c743b,Bharti Airtel,4 days ago,The Economic Times,"Sensex falls over 150 points; Nifty slips below 24,000. Airtel and IndiGo shares decline by up to 4% during trading.",https://x.com/ETMarkets/status/2059119363731698091,2026-05-30T10:35:01.714583+00:00
